293,Artists International Association,8,20th century 1900-1945,"Le Sphinx	Le Sphinx, 4 a.m. Verso: Three figure drawings	Bombed Women and Searchlights	Portrait of a Worker	Blitz: Plane Flying	The Means Test	Empire Builders	Leicester Square	The Means Test 2	Quiet Evening	Soldier, Soldier	The Street	The Fall of London: Waterloo	The Fall of London: Through the City	The Fall of London: The Horseguard	His Majesty's Servants	The Fall of London: Museum	The Fall of London: Corner House	The Fall of London: London Bridge	The Family	Gosfield Street Murder	The Fall of London: The Colosseum	The Station	The Fall of London: Looters	Parr's Stores	The Cinema	The Theatre"
294,Bauhaus,8,20th century 1900-1945,Study for Homage to the Square: Beaming	Study for Homage to the Square	Swinging	Study for Homage to the Square	Untitled Abstraction V	Homage to the Square: Study for Nocturne	Study for Homage to the Square: Departing in Yellow	K VII	Comedy	A Young Lady's Adventure	Delta	Beta	Homeward	Circle	White Line Square IV
295,Bloomsbury Group,8,20th century 1900-1945,"Still Life on Corner of a Mantelpiece	Helen Dudley	Interior at Gordon Square	The Kitchen	Frederick and Jessie Etchells Painting	The Mantelpiece	Queen of Sheba	Abstract Painting	Essay in Abstract Design	The Basket of Fruit	Mandolinist	Still Life: Flowers	The Ass	The Tub	Merry-Go-Round	Head of Eve	Garden Path in Spring	Studland Beach. Verso: Group of Male Nudes by Duncan Grant	The Tub	Venus and Adonis	Mrs St John Hutchinson	Landscape with Shepherd, near Villa Madama, Rome	Bridge over the Allier	Still Life with T'ang Horse	River with Poplars	Landscape, Sussex	Interior with a Table	Portrait of a Woman	Nude	The Artist's Mother	Lady Strachey	Lemon Gatherers	The Queen of Sheba	South of France	Violin Case and Flowers	Girl at the Piano	Portrait of a Girl	Chrysanthemums	Jewish Family	Acrobats	Lady Ottoline Morrell	Bathing	Football	Lytton Strachey. Verso: Crime and Punishment	James Strachey	Pheasants	The Servant Girl	The Hayrick	Vanessa Bell	The Tea Pot	Dancers	Still Life with Carrots	Untitled	Washerwoman	Interior	Standing Woman	[title not known]	Rock-cut Church, Aubeterre	Notre Dame, Clermont Ferrand	A Staircase / Narbonne	Rock-cut Church, Saint Emilion	Elne	Arles sur Tech	Cluny Museum, Paris	Trinity College Library, Cambridge	Baroque Altar, Perpignon"
296,Brücke,8,20th century 1900-1945,Bathers at Moritzburg	Woman with a Bag	Dr Rosa Schapire	Two Women	Male Head
297,Camden Town Group,8,20th century 1900-1945,"The Artist's Wife	La Hollandaise	Piccadilly Circus	Chateau d'Auppegard	Flowers in a Jug	Tea with Sickert	Girl at a Window, Little Rachel	North London Girl	The Fig Tree	Rule Britannia	Study for 'Ennui'	Attic Room	The Cinder Path	Harold Gilman	The Gas Cooker	Study for a Mural Decoration for 'The Cave of the Golden Calf'	A Singer at the Bedford Music Hall	Madeleine Knox	La Vieille Balayeuse, Dieppe	Victoria Embankment Gardens	Clarence Gardens	The Beanfield, Letchworth	From a Window in Cambrian Road, Richmond	Woman Washing her Hair	L'Américaine	The Café Royal	Tipperary	Mornington Crescent	Horse Sale at the Barbican	Waterfall	Ivy Cottage, Coldharbour: Sun and Snow	The Artist's Mother	The Cab Horse	Emergency Water Storage Tank	A Marengo	Letchworth	Leeds Market	Richmond Park	The Little Tea Party: Nina Hamnett and Roald Kristian	Snow in Pimlico	The Blacksmith's Shop	Flask Walk, Hampstead, on Coronation Day	Self-Portrait	Jacques-Emile Blanche	Porthleven	Houghton Place	Ennui	Roquefort	Swiss Cottage	Fried Fish Shop	Hartland Point from Boscastle	Dancing in the Street	Mrs Mounter at the Breakfast Table	Inez and Taki	The New Bedford	Ennui"
298,Constructivism,8,20th century 1900-1945,"T and Swallow	Linear Construction No. 2	Torsion (Project for a Fountain)	Composition in Yellow, Black and White	Swinging	Interrelation of Volumes	Construction on a Line	Model for 'Torsion'	Model for 'Construction in Space with Crystalline Centre'	Linear Form (curved)	Red Cavern	Model for 'Construction Through a Plane'	Linear Form (possible part of the model for the First Bijenkorf Project)	Circular Relief	Two Cubes (Demonstrating the Stereometric Method)	Model for 'Double Relief in a Niche'	Model for a 'Monument to the Unknown Political Prisoner'	Model for the Esso Project, Radio City, New York	Model for 'Spiral Theme'	Model for 'Column'	First Sketch for a Monument for an Institute of Physics and Mathematics	Sketch for a Mobile Construction	Model for Hanging Construction	First Model for a 'Monument to the Unknown Political Prisoner'	Linear Form (probably part of the model for the First Bijenkorf Project)	Model for Monument for an Airport	Model for 'Construction on a Line'	Model for a Construction at the Bijenkorf Building, Rotterdam	Model for 'Linear Construction No. 3 with Red'	Model for 'Construction in Space 'Crystal''	Model for 'Construction in Space, Suspended'	Model for 'Monument to the Astronauts'	Model for 'Construction in Space 'Two Cones''	Construction in a Niche	Model for Hanging Piece	Construction in Space 'Two Cones'	Torsion	Model for 'Spheric Theme'	Oval Sculpture (No. 2)	Landscape Sculpture	Drawing for 'Sculpture with Colour' (Forms with Colour)	The Autumn Crocus	Headland	Construction in Space: Diagonal	Construction: Stone with a Collar	Monument for an Airport	Construction in Space with Crystalline Centre	Construction in Space (Crystal)	Model for 'Rotating Fountain'	Red Stone	Model for 'Constructed Torso'	1939-44 (painted relief)	Sculpture with Colour (Deep Blue and Red)	Three Forms (Carving in Grey Alabaster)	Discs in Echelon	Pelagos	Painting	Forms in Echelon	Lines in Space No. 34	Three Forms	Single Form (Eikon)	Untitled	Pierced Hemisphere II	Lines in Space No. 3	Forms	Five Forms	Kinetic Construction (Standing Wave)	Structurist Relief, Red Wing No. 20	Bronze Spheric Theme	Cretan Queen	Spiral Theme	Antennae with Red and Blue Dots	Nude	Painting	Ile de France	Homage to Léger	K VII	Model for 'Construction in Space 'Arch''	Forms on Grey	Eight Forms and Three Circles	White Track	Ball, Plane and Hole	For the Facade of a Museum	No. 98 2478 Red/135 Green	Head No. 2	Relief Construction	Construction. Grey Lines on Pink Ground	Sobranie Collage	Untitled	[no title]	[no title]	[no title]	[no title]	[no title]	[no title]	[no title]	[no title]	[no title]	[no title]	[no title]	[no title]	Untitled	[no title]	[no title]	Untitled	[no title]	[no title]	Untitled	[no title]	[no title]	[no title]	[no title]	[no title]	[no title]	[no title]	[no title]	[no title]	Untitled	abstract 1936	Untitled	10. New Man	[title page]	3. Postman	5. Globetrotter (in Time)	9. Gravediggers	4. Anxious People	1. Part of the Show Machinery	8. Old Man (Head 2 Steps behind)	6. Sportsmen	7. Troublemaker	2. The Announcer	[no title]	[no title]	[no title]	[no title]	Opus 10	Opus 2	Opus 4	Opus 1	Opus 12	Opus 5	Opus 6	Opus 7	Opus 11	Opus 3	Opus 9	Opus 8"
299,Cubism,8,20th century 1900-1945,"Figure	Guitar Player in Armchair	Glass on a Table	Still Life	Large Horse	Clarinet and Bottle of Rum on a Mantelpiece	Windows Open Simultaneously (First Part, Third Motif)	Pipe and Domino	Still Life with Guitar	Overlooking the Bay	Bottle of Rum and Newspaper	Seated Harlequin	Bottle and Glass	Head of a Young Girl	Bowl of Fruit	Seated Bather	Seated Man with Clarinet I	Sculpture	Head	Still Life	The Lovers	Woman with a Coffee Pot	Interior with a Double Bass	Head of a Woman	Cubist Bust	The Billiard Table	Mandora	Coffee Mill	Painting	Bottle of Vieux Marc, Glass, Guitar and Newspaper	Bottle and Fishes	The Tree A	Portrait of Jacques Nayral	Sculpture	Bust of a Woman	Violin and Fruit-Dish	Rain	Seated Nude	1933 (guitar)	Venus	The Sunblind"
300,Dada,8,20th century 1900-1945,"According to the Laws of Chance	Portrait of Edison	Cadeau	New York	The Autumn Crocus	Dadaville	Opened by Customs	(Relief in Relief)	Torn-Up Woodcut	L'Enigme d'Isidore Ducasse	The Lovers	Ce qui manque à nous tous	Emak Bakia	The Art Critic	3 stoppages étalon (3 Standard Stoppages)	Fountain	Coffee Mill	The Fig-Leaf	Picture of Spatial Growths - Picture with Two Small Dogs	Red Wire Sculpture	The Bride Stripped Bare by her Bachelors, Even (The Large Glass)	Alarm Clock"
301,Der Blaue Reiter,8,20th century 1900-1945,Cossacks
303,Direct Carving,8,20th century 1900-1945,Head	Figure of a Woman	Mother and Child	Mask	Man with a Bird	The North Wind	St Sebastian	Crucifix	Ecstasy	Christ Child	Johanaan	Sculpture with Profiles	Fish	Composition	Half-figure	Figure	Model for Sculpture: The South Wind	Torso	Three Forms (Carving in Grey Alabaster)	Infant	Seated Figure	The Man Child	Oak Rhythm	Three Forms	Maternity	Eve	Jacob and the Angel	Fish	Two Forms	Four-Piece Composition: Reclining Figure	Swan	The East Wind	Venus	Girl	Mankind	Recumbent Figure	Torso
304,Euston Road School,8,20th century 1900-1945,"Casualty Reception Station, Capua	On the Map	Hickbush, the Grove I	Dover Front	Seated Nude	Wellington Square	Winifred Burger	Market Place	Fort Burgoyn, Dover	Nude, Camberwell	Nude	The Quiet River: The Thames at Chiswick	Studio Interior	Path with Elder and Hazel	Natalie Dower	Nude Model	Demolition of Verlaine's House	Reclining Nude	Interior with a Nude and a Still Life	Reclining Nude	Havildar Ajmer Singh	Man with a Beard	Lamplight	Portrait Group	Private Clarke, A.T.S.	Still Life with Skull	Miss Anne Popham	Inez Spender"
305,Expressionism,8,20th century 1900-1945,"A Rose Among Many Waters	Morning after Rain	The Crab	Loreley	Marianne-Maquis	The Sick Child	Back from the Races	Woman with a Bag	The Two Travellers	The Death of Diarmuid, the Last Handful of Water"
306,Fauvism,8,20th century 1900-1945,"Open Window at Saint-Jeannet	The Kessler Family on Horseback	The Wheatfield	The Kessler Family on Horseback	Standing Nude	Henri Matisse	Deauville, Drying the Sails	André Derain	The Pool of London	Nude, Fitzroy Street, No. 1"
307,Futurism,8,20th century 1900-1945,Study for 'Returning to the Trenches'	Bursting Shell	Abstract Speed - The Car has Passed	Explosion of Red on Green	Dance Hall Scene	Suburban Train Arriving in Paris	The Arrival	Unique Forms of Continuity in Space	La Mitrailleuse	The Syphon
308,German Expressionism,8,20th century 1900-1945,Z 105 Portals of Houses	A Married Couple	Suicide	Woman with a Bag	Dr Rosa Schapire	Two Women	Male Head
309,Group X,8,20th century 1900-1945,Portrait Sketch: Seated Woman with Beads	Athletes Exercising in a Gymnasium	The Diners	Sparring Partners	The Cinema	Mrs Schiff	Reconstruction	The Horsemen	Edith Sitwell
311,Modern Realism,8,20th century 1900-1945,Sleeping Girl	Still Life	The Painter and his Family	Nude with Loaves
312,Neo-Romanticism,8,20th century 1900-1945,"Black Landscape	Man Hosing Metal Fish Boxes	Grace Sholto Douglas	Glaciated Rocks, Nant Ffrancon	Leaping Figure	Small Assembly of Figures	The Jug on the Window	Corte, Corsica	Woman with Paper Flowers	The Temptation of St Anthony	Standing Forms II	The Quest	This Extraordinary Year, 1945	Flight of the Magnolia	Horned Forms	Composition: The Death of James Dean	Hotel by the Sea	Portuguese Cannon, Mazagan, Morocco	Two Sisters	Street and Railway Bridge	Children by the Sea	The Golden Wheel	Yarnton Monument	Landscape at Les Baux	Harvest	Dreamer in Landscape	Fata Morgana	Pastoral for P.W.	Dark Landscape	The White Root	Communication of Hate	Portrait of Kevin Maybury	The Fortune Teller	A Land Unvisited	Wittenham Clumps	The Courtesan	Medea's House, Corinth	Figure Drawing	Figure Drawing	Figure Drawing	Nude	The Captive Seven	Self-Portrait	Landscape from a Dream	Welsh Landscape with Roads	Green Tree Form: Interior of Woods	The Dairy, Fawley Court	Woman with Leaping Cat	Mrs R.A. Gorer	The Origins of the Land	Totes Meer (Dead Sea)	Furnaces	Seaton Delaval	Tapping a Blast Furnace	All Saints Chapel, Bath	Devastation, 1941: An East End Street	Devastation, 1941: East End, Burnt Paper Warehouse	St Mary le Port, Bristol	Devastation, 1941: East End, Wrecked Public House	The Messerschmidt in Windsor Great Park	Somerset Place, Bath	Crucifixion	Bomber in the Corn	Pillar and Moon	The Somnambulist	Head III	Entrance to a Lane	Au Cirque	Clown	Bearded Head	Self-Portrait	The Fool	Head	The Artist's Wife Seated in a Tree	Tree & Hills	Landscape	Landscape	Bird Smoking a Pipe	The Pilgrim	Foliate Head	iii	[no title]	[no title]	[no title]	[no title]	[no title]	[no title]	iv	i	[no title]	[no title]	ii	[no title]	Drysllwyn Castle	Pastoral	Horseguards in their Dressing Rooms at Whitehall	Clegyr Boia	Cray Fields	Pecken Wood	The Voice of the Fool	The Fool with a Fish	Head	The Joy of the Fool	Island	Foliate Heads II	Foliate Heads I	Figure with a Boat"
313,Objective Abstraction,8,20th century 1900-1945,Painting	Study	Two Females	Triangle to Beyond	Objective Abstraction	Painting	Blossoms
314,Orphic Cubism,8,20th century 1900-1945,Endless Rhythm	Triptych	Prose on the Trans-Siberian Railway and of Little Jehanne of France
316,Rayonism,8,20th century 1900-1945,Rayonist Composition	Rayonist Drawing	Nocturne
317,Realism,8,20th century 1900-1945,The Invalid
318,Supremetism,8,20th century 1900-1945,Dynamic Suprematism	Relief
319,Seven and Five,8,20th century 1900-1945,"Beach with Starfish	Triangle to Beyond	Abstract Composition	Three Forms	Construction, Intersection	Construction	Still Life	1924 (first abstract painting, Chelsea)	Autumn Composition, Flowers on a Table	Flower Table	1928 (foothills, Cumberland)	Wings over Water	Abstract I"
320,Surrealism,8,20th century 1900-1945,"Danger of Death	According to the Laws of Chance	Impish Fruit	The Doll	A Naturalist's Study	The Reckless Sleeper	A Present for the Past	The Doll	Metamorphosis of Narcissus	Cadeau	New York	Azure Day	Guitar and Profile	Star, Winged Being, Fish	Kitchen-maids	Sirens	Dadaville	Woman	Moustaches	Do You Know My Aunt Eliza?	I am an Amateur of Velocipedes	Otaïti	Men Shall Know Nothing of This	Pisces	Constellation According to the Laws of Chance	Message from a Friend	A Star Caresses the Breast of a Negress (Painting Poem)	Virgin Shroud	Black Virtue	Painting	The Invisibles	Man with a Newspaper	L'Enigme d'Isidore Ducasse	The Lovers	Ce qui manque à nous tous	Pincushion to Serve as Fetish	Some Roses and Their Phantoms	Nue couchée	Emak Bakia	The Doll	Indestructible Object	Composition (Man and Woman)	Celebes	Hour of the Traces	Mountain Lake	Head of a Catalan Peasant	Forgotten Horizon	The Spirit of Geometry	Exquisite Corpse	The Annunciation	Sleeping Venus	Montserrat	The Future of Statues	Lobster Telephone	Pietà or Revolution by Night	Sculpture to be Lost in the Forest	Forest and Dove	L'Hôtel Sully, Courtyard with Figures	Peg-Top	The Handsome Pork-Butcher	Curves and Circles	I Saluted at Six Paces Commandant Lefebvre des Noëttes (Poem object)	Winged Being	Eine Kleine Nachtmusik	Planet Set, Tête Etoilée, Giuditta Pasta (dédicace)	Walking Woman	Determination of Gender	The Uncertainty of the Poet	Portrait of a Doctor	The Painter's Family	Ibdes in Aragon	1933 (guitar)	The Entire City	Pagoda Fruit	Women and Bird in the Moonlight	Untitled	Untitled II	Untitled I	Untitled III	Untitled from 'La Brebis galante'	Series II	Dangerous Correspondances	Untitled	I Extend My Arms	Untitled	Crystal Heads, British Museum, London, June-July 1936	Untitled	A Dream Within a Dream	Saint Martin Landscape	The Conductor	The Matador	The Great Carnivore	King of Aragon	Untitled	Composition	Constellations"
321,Unit One,8,20th century 1900-1945,"1934 (relief)	Dieppe	Composition	1934-6 (painting - still life)	1934 project for Massine for Beethoven 7th Symphony Ballet	Mother and Child	June 1937 (painting)	1935 (white relief)	Equivalents for the Megaliths	Three Forms (Carving in Grey Alabaster)	Discs in Echelon	Forms in Echelon	Three Forms	Single Form (Eikon)	Composition 1933 (Interior)	Jan 27 1933	1936 (white relief sculpture - version 1)	Kinetic Feature	Two Forms	Variation on the Form of an Anchor	Ball, Plane and Hole	Four-Piece Composition: Reclining Figure	Landscape at Large	circa 1936 (sculpture)	Dancing Skeletons	Harlem	1933 (guitar)	The Beached Margin	Recumbent Figure	Foxy and Frankie (1)	abstract	Foxy and Frankie (2)"
322,Vorticism,8,20th century 1900-1945,"Study for 'Two Step'	Study for 'In the Hold'	Torso in Metal from 'The Rock Drill'	Garden Ornament	Study for 'The Rock Drill'	The Diners	The Crowd	Abstract Multicoloured Design	The Mud Bath	Vorticist Composition	Abstract Composition in Blue and Yellow	Monochrome Abstract Composition	Sparring Partners	Workshop	Sketches for 'The Dancer'	Abstract Composition	Abstract Drawing	The Return of Ulysses	Garden Ornament	Two Mechanics	Planners: Happy Day	Abstract Composition	Madge Pulsford	Reconstruction	The Lake	Fish	Totem	The Horsemen	Study for 'The Tea Garden'	Drawing for 'The Return of Ulysses'	Mechanised Head	Granite Quarries, Darby Hill, Oldbury	Red Stone Dancer	Composition	vi	iii	iv	View of a Town	'The Withered Root' by Rhys Davies"
340,Conversation Piece,290,18th century,"The Schutz Family and their Friends on a Terrace	An Elegant Company Playing Cards	Three Daughters of John, 3rd Earl of Bute	Three Sons of John, 3rd Earl of Bute	Colonel Mordaunt's Cock Match	Study for 'The Bennett Family'	Breaking-Up Day at Dr Clayton's School at Salford	[title not known]	[title not known]	Members of the Carrow Abbey Hunt	Samuel Richardson, the Novelist (1684-1761), Seated, Surrounded by his Second Family	Conversation Piece	Colonel Blair with his Family and an Indian Ayah	A Musical Assembly	Mr and Mrs Dalton and their Niece Mary de Heulle	The Indian Emperor, engraved by Robert Dodd	The Children of George Bond of Ditchleys	The Author and his Reader; a Frontispiece to 'The Tatler'	Sketch of a Group of Five Gentlemen around a Table	Group of Three Ladies in a Garden	A Family Group of Seven Persons Standing on a Terrace	A Family Group of Five Persons, Knee-length	The Strode Family	The Betts Family	The James Family	The Bradshaw Family	An English Family at Tea	Mr Oldham and his Guests	George Thompson, his Wife and (?) his Sister-in-Law"
341,Fancy Picture,290,18th century,"A Music Party	A Girl Buying a Ballad	A Girl Sewing	Sir Arthegal, the Knight of Justice, with Talus, the Iron Man (from Spenser's 'Faerie Queene')	The Housemaid	Lady Hamilton as Circe	The Age of Innocence	Lady Hamilton (?as a Figure in 'Fortune Telling')	Lady Hamilton as Cassandra	Mrs Hartley as a Nymph with a Young Bacchus	A Child's Portrait in Different Views: 'Angel's Heads'	The Fortune-Teller	Boy and Cat	Puck or Robin Goodfellow	Figure Study for 'The Housemaid'	Tom Hayley as Robin Goodfellow"
342,Grand Tour,290,18th century,"Rome: St Peter's and the Vatican from the Janiculum	Lake Avernus and the Island of Capri	Ariccia	Distant View of Maecenas' Villa, Tivoli"
343,Modern Moral Subject,290,18th century,"The Dance (The Happy Marriage ?VI: The Country Dance)	O the Roast Beef of Old England ('The Gate of Calais')	The Staymaker, engraved by Joseph Haynes	The March to Finchley	The Enraged Musician	A Rake's Progress (plate 4)	A Rake's Progress (plate 8)	A Rake's Progress (plate 3)	A Rake's Progress (plate 5)	Four Prints of an Election, plate 4: Chairing the Members	Gin Lane	A Rake's Progress (plate 7)	Four Prints of an Election, plate 2: Canvassing for Votes, engraved by Charles Grignion	The Staymaker (? The Happy Marriage V: The Fitting of the Ball Gown)"
